{
  "C00": {
    "vector_ids": [
      "V230-C00-SELECTOR_PHASE_COMPLETE",
      "V230-C00-MISSING_PHASE_NORM",
      "V230-C00-BROKEN_BOOT_BINDING",
      "V230-C00-TAMPERED_MERKLE_PROOF"
    ]
  },
  "C01": {
    "vector_ids": [
      "V230-C01-SELECTOR_PHASE_COMPLETE",
      "V230-C01-MISSING_PHASE_NORM",
      "V230-C01-BROKEN_BOOT_BINDING",
      "V230-C01-TAMPERED_MERKLE_PROOF"
    ]
  },
  "C02": {
    "vector_ids": [
      "V230-C02-SELECTOR_PHASE_COMPLETE",
      "V230-C02-MISSING_PHASE_NORM",
      "V230-C02-BROKEN_BOOT_BINDING",
      "V230-C02-TAMPERED_MERKLE_PROOF"
    ]
  },
  "C03": {
    "vector_ids": [
      "V230-C03-SELECTOR_PHASE_COMPLETE",
      "V230-C03-MISSING_PHASE_NORM",
      "V230-C03-BROKEN_BOOT_BINDING",
      "V230-C03-TAMPERED_MERKLE_PROOF"
    ]
  },
  "C04": {
    "vector_ids": [
      "V230-C04-SELECTOR_PHASE_COMPLETE",
      "V230-C04-MISSING_PHASE_NORM",
      "V230-C04-BROKEN_BOOT_BINDING",
      "V230-C04-TAMPERED_MERKLE_PROOF"
    ]
  },
  "C05": {
    "vector_ids": [
      "V230-C05-SELECTOR_PHASE_COMPLETE",
      "V230-C05-MISSING_PHASE_NORM",
      "V230-C05-BROKEN_BOOT_BINDING",
      "V230-C05-TAMPERED_MERKLE_PROOF"
    ]
  },
  "C06": {
    "vector_ids": [
      "V230-C06-SELECTOR_PHASE_COMPLETE",
      "V230-C06-MISSING_PHASE_NORM",
      "V230-C06-BROKEN_BOOT_BINDING",
      "V230-C06-TAMPERED_MERKLE_PROOF"
    ]
  },
  "C07": {
    "vector_ids": [
      "V230-C07-SELECTOR_PHASE_COMPLETE",
      "V230-C07-MISSING_PHASE_NORM",
      "V230-C07-BROKEN_BOOT_BINDING",
      "V230-C07-TAMPERED_MERKLE_PROOF"
    ]
  },
  "C08": {
    "vector_ids": [
      "V230-C08-SELECTOR_PHASE_COMPLETE",
      "V230-C08-MISSING_PHASE_NORM",
      "V230-C08-BROKEN_BOOT_BINDING",
      "V230-C08-TAMPERED_MERKLE_PROOF"
    ]
  },
  "C09": {
    "vector_ids": [
      "V230-C09-SELECTOR_PHASE_COMPLETE",
      "V230-C09-MISSING_PHASE_NORM",
      "V230-C09-BROKEN_BOOT_BINDING",
      "V230-C09-TAMPERED_MERKLE_PROOF"
    ]
  },
  "C10": {
    "vector_ids": [
      "V230-C10-SELECTOR_PHASE_COMPLETE",
      "V230-C10-MISSING_PHASE_NORM",
      "V230-C10-BROKEN_BOOT_BINDING",
      "V230-C10-TAMPERED_MERKLE_PROOF"
    ]
  },
  "C11": {
    "vector_ids": [
      "V230-C11-SELECTOR_PHASE_COMPLETE",
      "V230-C11-MISSING_PHASE_NORM",
      "V230-C11-BROKEN_BOOT_BINDING",
      "V230-C11-TAMPERED_MERKLE_PROOF"
    ]
  },
  "artifact_version": "2.31",
  "release_id": "v2.31_Public_BOIS_Common_Core",
  "summary": {
    "fail_count": 0,
    "pass_count": 84,
    "vector_count": 84
  },
  "vector_set_id": "v2.31_Public_BOIS_Common_Core_Capsule_Test_Vectors",
  "vectors": [
    {
      "expected": "PASS",
      "fixture": {
        "base": {
          "phase": "C00",
          "phase_capsule_sha256": "c19a382a0b95c908105564f56585e0aab5a4fd1b700ecd54a19e4ae943059f8b",
          "selector_input": {
            "action_class": "OBSERVE",
            "active_layers": [
              "BASE",
              "PERSONAL"
            ],
            "authority_state": "NOT_REQUIRED",
            "object_types": [
              "InputContainer",
              "Phenomenon",
              "Source"
            ],
            "phase": "C00",
            "risk_class": "LOW",
            "scope": [
              "core"
            ],
            "unresolved_debts": []
          },
          "task_capsule_sha256": "cf8e98296ddafcb460602348cc72ac9e4aa011922aa0a836b401359ad18d6afc"
        },
        "mutation": {
          "expected_norm_ids": [
            "N-GEN-003",
            "N-GEN-005",
            "N-GEN-006",
            "N-GEN-010",
            "N-GEN-022",
            "N-GEN-023",
            "N-GEN-031",
            "N-GEN-033",
            "N-GEN-037",
            "N-GEN-038",
            "N-GEN-041",
            "N-GEN-046",
            "N-GEN-050",
            "N-GEN-051",
            "N-GEN-064",
            "N-GEN-069",
            "N-GEN-078",
            "N-O001-01",
            "N-O001-02",
            "N-O001-03",
            "N-O001-04",
            "N-O001-05",
            "N-O001-06",
            "N-O001-07",
            "N-O001-10",
            "N-O002-02",
            "N-O002-04",
            "N-O003-04",
            "N-O005-03",
            "N-O005-05",
            "N-O005-06",
            "N-O008-04",
            "N-O008-10",
            "N-O009-10",
            "N-O010-10",
            "N-O011-05",
            "N-O011-10",
            "N-O012-05",
            "N-O015-01",
            "N-O018-02",
            "N-O019-06",
            "N-O020-04",
            "N-O020-06",
            "N-O023-10",
            "N-O024-01",
            "N-O025-02",
            "N-O026-02",
            "N-O026-06",
            "P-N-029",
            "P-N-040"
          ],
          "selected_norm_ids": [
            "N-GEN-005",
            "N-GEN-006",
            "N-GEN-010",
            "N-GEN-003",
            "N-GEN-078",
            "N-GEN-022",
            "N-GEN-023",
            "N-GEN-031",
            "N-GEN-033",
            "N-GEN-037",
            "N-GEN-038",
            "N-GEN-041",
            "N-GEN-046",
            "N-GEN-050",
            "N-GEN-051",
            "N-GEN-064",
            "N-GEN-069",
            "P-N-029",
            "P-N-040",
            "N-O001-01",
            "N-O001-02",
            "N-O001-03",
            "N-O001-04",
            "N-O001-05",
            "N-O001-06",
            "N-O001-07",
            "N-O001-10",
            "N-O002-02",
            "N-O002-04",
            "N-O003-04",
            "N-O005-03",
            "N-O005-05",
            "N-O005-06",
            "N-O008-04",
            "N-O008-10",
            "N-O009-10",
            "N-O010-10",
            "N-O011-05",
            "N-O011-10",
            "N-O012-05",
            "N-O015-01",
            "N-O018-02",
            "N-O019-06",
            "N-O020-04",
            "N-O020-06",
            "N-O023-10",
            "N-O024-01",
            "N-O025-02",
            "N-O026-02",
            "N-O026-06"
          ]
        }
      },
      "observed": "PASS",
      "operation": "SELECTOR_PHASE_COMPLETE",
      "phase": "C00",
      "trace_sha256": "e4bdd11bfeba477ee2c745daac17c81540f69f625d1aa6cbc203590f26f4700f",
      "vector_id": "V230-C00-SELECTOR_PHASE_COMPLETE"
    },
    {
      "expected": "HOLD-RUNTIME-CAPSULE-INCOMPLETE",
      "fixture": {
        "base": {
          "phase": "C00",
          "phase_capsule_sha256": "c19a382a0b95c908105564f56585e0aab5a4fd1b700ecd54a19e4ae943059f8b",
          "selector_input": {
            "action_class": "OBSERVE",
            "active_layers": [
              "BASE",
              "PERSONAL"
            ],
            "authority_state": "NOT_REQUIRED",
            "object_types": [
              "InputContainer",
              "Phenomenon",
              "Source"
            ],
            "phase": "C00",
            "risk_class": "LOW",
            "scope": [
              "core"
            ],
            "unresolved_debts": []
          },
          "task_capsule_sha256": "cf8e98296ddafcb460602348cc72ac9e4aa011922aa0a836b401359ad18d6afc"
        },
        "mutation": {
          "removed_norm_id": "N-GEN-003"
        }
      },
      "observed": "HOLD-RUNTIME-CAPSULE-INCOMPLETE",
      "operation": "MISSING_PHASE_NORM",
      "phase": "C00",
      "trace_sha256": "5d2f4595974df8a2531e770e222c81dafa42d43b939de7eb8781e0a34d6f07a4",
      "vector_id": "V230-C00-MISSING_PHASE_NORM"
    },
    {
      "expected": "HOLD-RUNTIME-CAPSULE-INCOMPLETE",
      "fixture": {
        "base": {
          "phase": "C00",
          "phase_capsule_sha256": "c19a382a0b95c908105564f56585e0aab5a4fd1b700ecd54a19e4ae943059f8b",
          "selector_input": {
            "action_class": "OBSERVE",
            "active_layers": [
              "BASE",
              "PERSONAL"
            ],
            "authority_state": "NOT_REQUIRED",
            "object_types": [
              "InputContainer",
              "Phenomenon",
              "Source"
            ],
            "phase": "C00",
            "risk_class": "LOW",
            "scope": [
              "core"
            ],
            "unresolved_debts": []
          },
          "task_capsule_sha256": "cf8e98296ddafcb460602348cc72ac9e4aa011922aa0a836b401359ad18d6afc"
        },
        "mutation": {
          "required_boot_capsule_sha256": "0000000000000000000000000000000000000000000000000000000000000000"
        }
      },
      "observed": "HOLD-RUNTIME-CAPSULE-INCOMPLETE",
      "operation": "BROKEN_BOOT_BINDING",
      "phase": "C00",
      "trace_sha256": "b960595716cd71da9cf1421125cb8e65af8e77c92a909eba51a8debd23bc24db",
      "vector_id": "V230-C00-BROKEN_BOOT_BINDING"
    },
    {
      "expected": "HOLD-RUNTIME-CAPSULE-INCOMPLETE",
      "fixture": {
        "base": {
          "phase": "C00",
          "phase_capsule_sha256": "c19a382a0b95c908105564f56585e0aab5a4fd1b700ecd54a19e4ae943059f8b",
          "selector_input": {
            "action_class": "OBSERVE",
            "active_layers": [
              "BASE",
              "PERSONAL"
            ],
            "authority_state": "NOT_REQUIRED",
            "object_types": [
              "InputContainer",
              "Phenomenon",
              "Source"
            ],
            "phase": "C00",
            "risk_class": "LOW",
            "scope": [
              "core"
            ],
            "unresolved_debts": []
          },
          "task_capsule_sha256": "cf8e98296ddafcb460602348cc72ac9e4aa011922aa0a836b401359ad18d6afc"
        },
        "mutation": {
          "proof_mutation": "flip_first_sibling_byte"
        }
      },
      "observed": "HOLD-RUNTIME-CAPSULE-INCOMPLETE",
      "operation": "TAMPERED_MERKLE_PROOF",
      "phase": "C00",
      "trace_sha256": "2dde2033640bb93139c436f2500b2658f57eb3b0a4a4957e19fa5529c84c573c",
      "vector_id": "V230-C00-TAMPERED_MERKLE_PROOF"
    },
    {
      "expected": "PASS",